{
 "format_version": "far-ir/2.0",
 "id": "adv.record",
 "contract": {
  "id": "adv.contract",
  "contract_version": "2.0",
  "mode": "approximate",
  "source_domain": {
   "status": "EXPLICIT",
   "kind": "finite_explicit",
   "description": "Explicit adversarial cases",
   "cases": [
    {
     "id": "case.a",
     "value": "case.a"
    },
    {
     "id": "case.b",
     "value": "case.b"
    }
   ]
  },
  "required_behavior": {
   "status": "EXPLICIT",
   "description": "Required behavior",
   "table": [
    {
     "case_id": "case.a",
     "value": "even"
    },
    {
     "case_id": "case.b",
     "value": "odd"
    }
   ]
  },
  "representation": {
   "status": "EXPLICIT",
   "description": "Candidate representation",
   "table": [
    {
     "case_id": "case.a",
     "value": 0
    },
    {
     "case_id": "case.b",
     "value": 1
    }
   ]
  },
  "observation_contexts": [
   {
    "id": "obs.primary",
    "description": "Observation",
    "status": "EXPLICIT"
   }
  ],
  "admitted_transformations": [
   {
    "id": "eq.identity",
    "kind": "equivalence",
    "description": "Literal equality",
    "status": "EXPLICIT"
   }
  ],
  "interpretation_profile": {
   "id": "interp.adv",
   "description": "Literal finite-table interpretation",
   "status": "EXPLICIT"
  },
  "target_model_class": {
   "id": "target.adv",
   "description": "Listed cases only",
   "status": "EXPLICIT"
  },
  "frame": {
   "id": "frame.empty",
   "description": "No background premises",
   "status": "EXPLICIT"
  }
 },
 "report": {
  "outcome": "PROVED",
  "evidence": {
   "kind": "factorization",
   "status": "CHECKED_FINITE_EXPLICIT",
   "decoder_table": [
    {
     "representation_value": 0,
     "behavior_value": "even"
    },
    {
     "representation_value": 1,
     "behavior_value": "odd"
    }
   ]
  },
  "failure_report": []
 },
 "provenance": {
  "producer": "audit_oracle_v2 adversarial corpus",
  "created_at": "2026-09-25T00:00:00Z",
  "sources": []
 },
 "freeze": {
  "status": "FROZEN",
  "frozen_at": "2026-09-25T00:00:00Z",
  "contract_sha256": "0e334d289c9df2f36a6967e3a04cddbf0e9aa16e02bbf9795e0cec3f774361e3"
 }
}
