{
 "format_version": "far-ir/2.0",
 "id": "adv.record",
 "contract": {
  "id": "adv.contract",
  "contract_version": "2.0",
  "mode": "exact",
  "source_domain": {
   "status": "EXPLICIT",
   "kind": "finite_explicit",
   "description": "Explicit adversarial cases",
   "cases": [
    {
     "id": "case.a",
     "value": "case.a"
    },
    {
     "id": "case.b",
     "value": "case.b"
    },
    {
     "id": "case.c",
     "value": "case.c"
    },
    {
     "id": "case.d",
     "value": "case.d"
    }
   ]
  },
  "required_behavior": {
   "status": "EXPLICIT",
   "description": "Required behavior",
   "table": [
    {
     "case_id": "case.a",
     "value": "x"
    },
    {
     "case_id": "case.b",
     "value": "x"
    },
    {
     "case_id": "case.c",
     "value": "y"
    },
    {
     "case_id": "case.d",
     "value": "y"
    }
   ]
  },
  "representation": {
   "status": "EXPLICIT",
   "description": "Candidate representation",
   "table": [
    {
     "case_id": "case.a",
     "value": "a"
    },
    {
     "case_id": "case.b",
     "value": "b"
    },
    {
     "case_id": "case.c",
     "value": "c"
    },
    {
     "case_id": "case.d",
     "value": "d"
    }
   ]
  },
  "observation_contexts": [
   {
    "id": "obs.primary",
    "description": "Observation",
    "status": "EXPLICIT"
   }
  ],
  "admitted_transformations": [
   {
    "id": "eq.identity",
    "kind": "equivalence",
    "description": "Literal equality",
    "status": "EXPLICIT"
   }
  ],
  "interpretation_profile": {
   "id": "interp.adv",
   "description": "Literal finite-table interpretation",
   "status": "EXPLICIT"
  },
  "target_model_class": {
   "id": "target.adv",
   "description": "Listed cases only",
   "status": "EXPLICIT"
  },
  "frame": {
   "id": "frame.empty",
   "description": "No background premises",
   "status": "EXPLICIT"
  }
 },
 "report": {
  "outcome": "PROVED",
  "evidence": {
   "kind": "quotient",
   "status": "CHECKED_FINITE_EXPLICIT",
   "claims_exact_observational_quotient": true,
   "classes": [
    {
     "id": "class.0",
     "case_ids": [
      "case.a",
      "case.b"
     ]
    },
    {
     "id": "class.1",
     "case_ids": [
      "case.b",
      "case.c",
      "case.d"
     ]
    }
   ]
  },
  "failure_report": []
 },
 "provenance": {
  "producer": "audit_oracle_v2 adversarial corpus",
  "created_at": "2026-09-25T00:00:00Z",
  "sources": []
 },
 "freeze": {
  "status": "FROZEN",
  "frozen_at": "2026-09-25T00:00:00Z",
  "contract_sha256": "2849e5de967bd9321011b8e4ca06c5963be1ea3629c11607e825927b09c214b8"
 }
}
